"Timestamp","Tu Nombre","Correo Electrónico","Número de WhatsApp (opcional)","Dispositivo en el que probaste","¿Cuál es tu primera impresión? ¿La app se ve profesional? ¿Está claro para qué sirve?","¿Funcionó el registro? ¿Algún problema?","¿Recibiste el correo de verificación?","¿Funcionó la configuración del perfil? ¿Algún problema con la subida de foto o al guardar?","¿Faltó algún deporte en la lista?","¿Fue fácil entender de qué se trata cada sesión? ¿Algo confuso?","¿Qué información faltaba o no estaba clara en las tarjetas de sesión?","¿Funcionó correctamente unirse y salir?","Si hubo problemas, ¿qué pasó?","¿Funcionó unirse como invitado?","¿Algún comentario sobre la experiencia de invitado?","¿Fue fácil crear una sesión? ¿Algún problema?","¿Cómo estuvo el selector de duración?","¿Cómo estuvo ingresar la ubicación?","¿Funcionó el chat?","Comentarios sobre el chat (opcional)","¿Funcionó la función de invitar?","Comentarios sobre invitar (opcional)","¿Funcionó el inglés?","¿Qué texto seguía en español? (si hubo)","Describe cualquier error que encontraste","¿Qué funcionó bien?","¿Qué fue frustrante o confuso?","¿Qué funciones te harían usar esta app regularmente?","Calificación general","¿Usarías Tribe para encontrar compañeros de entrenamiento?","¿Algo más que quieras compartir?"
"2025/12/15 4:23:35 PM EST","Verónica Marcela Giraldo Salgado ","vmgs981128@gmail.com","3054246439","Android","Me gusta la interfaz de la app. Es intuitiva. Me gusta que no está sobrecargada de elementos, sino que da la información de manera limpia y clara","El registro fue fácil y rápido, pero no recibí el correo de verificación. Incluso esperé unos minutos, pero no ha llegado aún.","No, nunca llegó","Todo funcionó correctamente. La foto no fue seleccionada en el primer intento. Pero la segunda vez se guardó correctamente.","Encontré los deportes de mi interés ","Se entiende fácilmente","Nivel de habilidad requerido;Equipamiento necesario","Sí, funcionó perfectamente","","Sí, funcionó muy bien","Podrían agregar la opción de desunirse como invitado también, en caso de cambiar de planes ","Fue fácil y rápido de crear","Fácil de usar","Fácil","Sí, los mensajes se enviaron y aparecieron","","Sí","","Bien pero quedó algo de texto en español","La descripción del evento","No encontré errores","La navegación es fácil","Nada","Calendario y recordatorio de las actividades que tienen relación con los deportes que seleccioné ","10","Probablemente sí","Todo salió correctamente. Me siento cómoda en la aplicación. La usaría"
"2025/12/17 1:55:04 PM EST","Mónica Caraballo ","Moni1226@hotmail.es","3008188485","iPhone","Una app diseñada para quienes buscamos hacer deporte en una manera más didáctica y grupal","Funcionó adecuadamente ","Sí, en mi bandeja de entrada","Sin problemas ","No","Fácil de entender ","Nada faltaba - todo claro","Sí, funcionó perfectamente","Ningún problema","Sí, funcionó muy bien","n/a","Sin problemas ","Fácil de usar","Fácil","Sí, los mensajes se enviaron y aparecieron","N/A","Sí","","Traducción perfecta","Adecuada traducción ","N/A","Toda la app","Nada","Actividades deportivas con fecha y lugares especificadas ","10","Definitivamente sí",""
"2025/12/17 3:53:57 PM EST","Adolfo Caraballo ","Adolfocaraballo99@hotmail.com","3002467994","iPhone","Me parece excelente y se para que sirve ","Funcionó muy bien","Sí, en mi bandeja de entrada","Ningun tipo de problema","No faltó ningún deporte ","Fue demasiado facil","Nada faltaba - todo claro","Sí, funcionó perfectamente","No hubo ningun problema","Sí, funcionó muy bien","Excelente la experiencia ","Fue muy fácil ","Fácil de usar","Fácil","Sí, los mensajes se enviaron y aparecieron","","Sí","","Traducción perfecta","","No hubo error","Todo funcionó bien ","Nada","Muchas","9","Definitivamente sí","No"
"2025/12/18 4:10:24 PM EST","Imelda silva","Imeldasilva@hotmail.com","3012753757","Android","Se ve muy profesional","Funciono bien","No, nunca llegó","Si funciono","Segun mis conocimientos, no","Facil de entender","Nada faltaba - todo claro","Sí, funcionó perfectamente","No","Sí, funcionó muy bien","Excelente experiencia","Muy facil","Fácil de usar","Fácil","Sí, los mensajes se enviaron y aparecieron","","Sí","","Traducción perfecta","","Ningun error","Todo funciono bien y rapido","Nada","Varias funciones","10","Definitivamente sí",""
"2025/12/18 5:04:01 PM EST","Adolfo caraballo ","Adolfocaraballo@hotmail.com","3014158837","iPhone","Muy buena impresión, estoy claro de para que sirve","Funciono muy bien ","Sí, en la carpeta de spam","Funciono muy bien sin ningún problema ","No falto ","Fácil de entender","Nada faltaba - todo claro","Sí, funcionó perfectamente","No hubo problemas","Sí, funcionó muy bien","Muy buena experiencia ","Muy fácil ","Fácil de usar","Fácil","Sí, los mensajes se enviaron y aparecieron","","Sí","","Traducción perfecta","","No hubo error ","Funciono bien","Nada ","Muchas funciones ","10","Definitivamente sí",""